<?xml version="1.0" encoding="UTF-8"?>
<bookInfo xmlns="http://www.cnblogs.com" xmlns:xsi="http://www.w3.org/2001/XMLSchema-instance"
	xsi:schemaLocation="http://www.cnblogs.com 4.xsd">
	<bookSort>technology</bookSort>
	<bookSort>novel</bookSort>
	<bookSort>history</bookSort>
	<book type="technology">
		<name>XML Schema应用</name>
		<quantity>2</quantity>
		<price>20</price>
	</book>
	<book type="novel">
		<name>疯狂程序员</name>
		<quantity>3</quantity>
		<price>15</price>
	</book>
	<book type="history">
		<name>三国志</name>
		<quantity>1</quantity>
		<price>30</price>
	</book>
</bookInfo>